{
  "version": "1.0.0",
  "status": "ai_researched_human_pending",
  "run_id": "batch_001_source_review_2026_07_30",
  "researched_at": "2026-07-30",
  "selected_organisation_ids": [
    "ORG-001",
    "ORG-002",
    "ORG-003"
  ],
  "prune_unused_sources": true,
  "sources": {
    "https://www.afd.fr/en/actualites/digital-energy-challenge-africa-energy-transition": {
      "title": "Digital Energy Challenge: innovative projects paving the way for Africa’s energy transition",
      "publisher": "Agence Française de Développement",
      "source_type": "official_programme",
      "author": "",
      "publication_date": "2024-11-28",
      "retrieved_at": "2026-07-30",
      "archived_url": "",
      "source_license": "unknown",
      "independence_class": "independent_primary",
      "automation_permitted": "false",
      "notes": "Locator: “Reducing power outages in Nigeria: AEDC x Beacon Power Services.” Supports the named partnership, Nigeria, the 2023 programme-support year and reported implementation activity. AFD administers the supporting programme; outcome figures require separate scrutiny."
    },
    "https://beaconpowerservices.com/": {
      "title": "Beacon Power Services — Transforming Energy Management in Africa through Innovation",
      "publisher": "Beacon Power Services",
      "source_type": "provider_webpage",
      "author": "",
      "publication_date": "",
      "retrieved_at": "2026-07-30",
      "archived_url": "",
      "source_license": "all_rights_reserved",
      "independence_class": "provider_authored",
      "automation_permitted": "false",
      "notes": "Locator: homepage and company footer. Used only for the provider’s current canonical website; it does not independently establish origin, headquarters or deployment."
    },
    "https://beaconpowerservices.com/en/solutions/caims": {
      "title": "CAIMS — Customer and Asset Information Management System | Beacon Power Services",
      "publisher": "Beacon Power Services",
      "source_type": "provider_product_page",
      "author": "",
      "publication_date": "",
      "retrieved_at": "2026-07-30",
      "archived_url": "",
      "source_license": "all_rights_reserved",
      "independence_class": "provider_authored",
      "automation_permitted": "false",
      "notes": "Locator: CAIMS overview, Features, Functionalities and Technical Specifications. Supports product functions as provider claims; customer outcomes are not imported from this page."
    },
    "https://beaconpowerservices.com/en/solutions/adora": {
      "title": "Adora — Grid Network Management | Beacon Power Services",
      "publisher": "Beacon Power Services",
      "source_type": "provider_product_page",
      "author": "",
      "publication_date": "",
      "retrieved_at": "2026-07-30",
      "archived_url": "",
      "source_license": "all_rights_reserved",
      "independence_class": "provider_authored",
      "automation_permitted": "false",
      "notes": "Locator: Adora overview, Features, Functionalities and Technical Specifications. Supports product functions as provider claims; performance claims are not imported."
    },
    "https://www.beaconpowerservices.com/en/solutions/xepp": {
      "title": "Xepp — Track energy, pay for electricity and go solar | Beacon Power Services",
      "publisher": "Beacon Power Services",
      "source_type": "provider_product_page",
      "author": "",
      "publication_date": "",
      "retrieved_at": "2026-07-30",
      "archived_url": "",
      "source_license": "all_rights_reserved",
      "independence_class": "provider_authored",
      "automation_permitted": "false",
      "notes": "Locator: Features, Functionalities and Technical Specifications. The page states that the app is available on iOS and Android and is free to download and use; product claims remain provider-authored."
    },
    "https://proparco.fr/en/news/beacon-power-services-harnessing-data-drive-africas-energy-transition": {
      "title": "Beacon Power Services: harnessing data to drive Africa’s energy transition",
      "publisher": "Proparco — AFD Group",
      "source_type": "dfi_report",
      "author": "",
      "publication_date": "2026-04-23",
      "retrieved_at": "2026-07-30",
      "archived_url": "",
      "source_license": "unknown",
      "independence_class": "independent_primary",
      "automation_permitted": "false",
      "notes": "Locators: “In Abuja, a network transitioning from ‘flying blind’ to real-time visibility” and the paragraph describing CAIMS, Adora and Xepp. Includes direct comment from an AEDC director. Proparco is a BPS investor, so reported outcomes are not imported without additional corroboration."
    },
    "https://digital-energy.eu/en/projects/pam-africa": {
      "title": "PAM AFRICA | Digital Energy Facility",
      "publisher": "Digital Energy Facility — AFD Group",
      "source_type": "official_programme",
      "author": "",
      "publication_date": "",
      "retrieved_at": "2026-07-30",
      "archived_url": "",
      "source_license": "unknown",
      "independence_class": "independent_primary",
      "automation_permitted": "false",
      "notes": "Locators: “The Project at a Glance,” “How It Works” and “Results So Far.” Supports PAM-AI, Nigeria, KEDCO and unnamed mini-grid implementations. It is programme evidence, not customer confirmation; outcome figures are excluded."
    },
    "https://www.powerlabstech.com/pai-enterprise/software": {
      "title": "Pai Enterprise Dashboard | PowerLabs",
      "publisher": "PowerLabs",
      "source_type": "provider_product_page",
      "author": "",
      "publication_date": "",
      "retrieved_at": "2026-07-30",
      "archived_url": "",
      "source_license": "unknown",
      "independence_class": "provider_authored",
      "automation_permitted": "false",
      "notes": "Locators: Analytics, Sizing Optimisation, Anomaly Detections and Use Cases. Supports the current product URL and provider-described functionality; it does not independently establish deployments."
    },
    "https://techcabal.com/2026/04/09/powerlabs-wants-to-make-nigerias-grid-think/": {
      "title": "This startup is building an ‘intelligence layer’ for Nigeria’s power grid",
      "publisher": "TechCabal",
      "source_type": "news_article",
      "author": "Frank Eleanya",
      "publication_date": "2026-04-09",
      "retrieved_at": "2026-07-30",
      "archived_url": "",
      "source_license": "unknown",
      "independence_class": "independent_secondary",
      "automation_permitted": "false",
      "notes": "Locators: article introduction, “How the system works” and the Pai Enterprise launch paragraph. Independently supports company and product existence, Lagos base and June 2025 launch. Regional usage is attributed to the founder and is retained only as claimed availability, never as deployment evidence."
    }
  },
  "record_overrides": {
    "organisations.csv": {
      "org_001": {
        "last_checked_at": "2026-07-30"
      },
      "org_002": {
        "headquarters_country": "",
        "website": "https://www.pamafrica.com/",
        "last_checked_at": "2026-07-30"
      },
      "org_003": {
        "website": "https://powerlabstech.com/",
        "description": "Energy intelligence software and hardware for orchestrating grid, solar, batteries and generators",
        "last_checked_at": "2026-07-30"
      }
    },
    "products.csv": {
      "prod_001": {
        "website": "https://beaconpowerservices.com/en/solutions/caims",
        "last_checked_at": "2026-07-30"
      },
      "prod_002": {
        "website": "https://beaconpowerservices.com/en/solutions/adora",
        "last_checked_at": "2026-07-30"
      },
      "prod_003": {
        "access_model": "public_access",
        "website": "https://www.beaconpowerservices.com/en/solutions/xepp",
        "last_checked_at": "2026-07-30"
      },
      "prod_004": {
        "description": "Real-time monitoring, smart tariffs, remote device control, payment integration and demand response",
        "lifecycle_status": "active",
        "website": "https://www.pamafrica.com/",
        "last_checked_at": "2026-07-30"
      },
      "prod_005": {
        "name": "Pai Enterprise",
        "slug": "pai-enterprise",
        "description": "Energy monitoring, analytics, sizing optimisation, anomaly detection and multi-source orchestration",
        "access_model": "commercial_service",
        "website": "https://www.powerlabstech.com/pai-enterprise/software",
        "launched_year": "2025",
        "last_checked_at": "2026-07-30"
      }
    },
    "deployments.csv": {
      "dep_001": {
        "lifecycle_status": "active",
        "last_checked_at": "2026-07-30"
      },
      "dep_002": {
        "lifecycle_status": "active",
        "last_checked_at": "2026-07-30"
      },
      "dep_003": {
        "subnational_area": "",
        "lifecycle_status": "active",
        "location_precision": "country",
        "last_checked_at": "2026-07-30"
      },
      "dep_004": {
        "subnational_area": "",
        "lifecycle_status": "active",
        "last_checked_at": "2026-07-30"
      }
    }
  },
  "assertion_rules": [
    {
      "subject_type": "organisation",
      "subject_id": "org_001",
      "predicates": [
        "name",
        "organisation_type",
        "origin_classification",
        "country_of_origin",
        "lifecycle_status",
        "description"
      ],
      "source_url": "https://proparco.fr/en/news/beacon-power-services-harnessing-data-drive-africas-energy-transition",
      "evidence_status": "independently_evidenced",
      "note": "The report identifies BPS as an African energy-technology start-up operating in Nigeria and describes its grid-management software. The single-country headquarters field remains unresolved."
    },
    {
      "subject_type": "organisation",
      "subject_id": "org_001",
      "predicates": [
        "website"
      ],